library/src/amd_detail/rocblaslt/src/Tensile/Logic/asm_full/aldebaran/110CU/Equality/aldebaran_Cijk_Ailk_Bljk_HHS_BH.yaml
- {MinimumRequiredVersion: 4.33.0}
- aldebaran
- gfx90a
- [Device 0050, Device 0051, Device 0052, Device 0054, Device 0062, Device 7400, Device
    SolutionIndex: 0
    SolutionNameMin: Cijk_Ailk_Bljk_HHS_BH_MT128x16x64_MI16x16x16x1_SN_1LDSB0_GRVW8_GSU1_LPB16_LRVW8_MIWT2_1_NEPBS0_NLCA1_PLR5_SS0_SU0_SUS0_SVW4_VW2_WG64_4_1_WGM1
    SolutionIndex: 1
    SolutionNameMin: Cijk_Ailk_Bljk_HHS_BH_MT128x16x64_MI16x16x16x1_SN_1LDSB0_GRVW4_GSU8_LPB4_LRVW4_MIWT2_1_NEPBS0_NLCA1_PLR5_SS0_SU32_SUS256_SVW2_VW2_WG64_4_1_WGM8
    SolutionIndex: 2
    SolutionNameMin: Cijk_Ailk_Bljk_HHS_BH_MT32x32x64_MI16x16x16x1_SN_1LDSB0_GRVW8_GSU8_LPB16_LRVW8_MIWT1_1_NEPBS0_NLCA1_PLR5_SS0_SU0_SUS0_SVW4_VW2_WG32_8_1_WGM8
    SolutionIndex: 3
    SolutionNameMin: Cijk_Ailk_Bljk_HHS_BH_MT128x128x32_MI32x32x8x1_SN_1LDSB1_GRVW8_GSU1_LPB8_LRVW4_MIWT2_2_NEPBS0_NLCA1_PLR5_SS1_SU4_SUS128_SVW2_VW2_WG64_4_1_WGM8
    SolutionIndex: 4
    SolutionNameMin: Cijk_Ailk_Bljk_HHS_BH_MT128x16x64_MI16x16x16x1_SN_1LDSB0_GRVW8_GSU1_LPB16_LRVW8_MIWT2_1_NEPBS0_NLCA1_PLR5_SS1_SU0_SUS0_SVW1_VW1_WG64_4_1_WGM1
    SolutionIndex: 5
    SolutionNameMin: Cijk_Ailk_Bljk_HHS_BH_MT96x128x64_MI32x32x8x1_SN_1LDSB0_GRVW8_GSU1_LPB8_LRVW8_MIWT3_1_NEPBS0_NLCA3_PLR9_SS1_SU0_SUS0_SVW1_VW1_WG32_8_1_WGM1
    SolutionIndex: 6
    SolutionNameMin: Cijk_Ailk_Bljk_HHS_BH_MT128x16x64_MI16x16x16x1_SN_1LDSB0_GRVW8_GSU8_LPB16_LRVW8_MIWT2_1_NEPBS2_NLCA1_PLR5_SS0_SU0_SUS0_SVW4_VW2_WG64_4_1_WGM1
    SolutionIndex: 7
    SolutionNameMin: Cijk_Ailk_Bljk_HHS_BH_MT128x16x64_MI16x16x16x1_SN_1LDSB0_GRVW4_GSU8_LPB4_LRVW4_MIWT2_1_NEPBS2_NLCA1_PLR5_SS0_SU0_SUS0_SVW2_VW2_WG64_4_1_WGM2
    SolutionIndex: 8
    SolutionNameMin: Cijk_Ailk_Bljk_HHS_BH_MT32x32x64_MI16x16x16x1_SN_1LDSB0_GRVW8_GSU8_LPB16_LRVW8_MIWT1_1_NEPBS2_NLCA1_PLR5_SS0_SU0_SUS0_SVW4_VW2_WG32_8_1_WGM1
    SolutionIndex: 9
    SolutionNameMin: Cijk_Ailk_Bljk_HHS_BH_MT96x128x64_MI32x32x8x1_SN_1LDSB0_GRVW8_GSU8_LPB8_LRVW4_MIWT3_1_NEPBS2_NLCA3_PLR9_SS0_SU0_SUS0_SVW4_VW1_WG32_8_1_WGM1
    SolutionIndex: 10
    SolutionNameMin: Cijk_Ailk_Bljk_HHS_BH_MT96x128x64_MI32x32x8x1_SN_1LDSB0_GRVW8_GSU8_LPB8_LRVW8_MIWT3_1_NEPBS2_NLCA3_PLR9_SS0_SU4_SUS256_SVW4_VW1_WG32_8_1_WGM1
    SolutionIndex: 11
    SolutionNameMin: Cijk_Ailk_Bljk_HHS_BH_MT128x128x32_MI32x32x8x1_SN_1LDSB0_GRVW8_GSU1_LPB8_LRVW8_MIWT2_2_NEPBS2_NLCA1_PLR5_SS1_SU4_SUS128_SVW2_VW2_WG64_4_1_WGM1
    SolutionIndex: 12
    SolutionNameMin: Cijk_Ailk_Bljk_HHS_BH_MT128x128x32_MI32x32x8x1_SN_1LDSB0_GRVW8_GSU1_LPB8_LRVW8_MIWT2_2_NEPBS2_NLCA1_PLR5_SS1_SU4_SUS256_SVW2_VW2_WG64_4_1_WGM1
    SolutionIndex: 13
    SolutionNameMin: Cijk_Ailk_Bljk_HHS_BH_MT128x128x32_MI32x32x8x1_SN_1LDSB1_GRVW8_GSU1_LPB8_LRVW4_MIWT2_2_NEPBS2_NLCA1_PLR5_SS1_SU0_SUS0_SVW2_VW2_WG64_4_1_WGM8
    SolutionIndex: 14
    SolutionNameMin: Cijk_Ailk_Bljk_HHS_BH_MT128x128x32_MI32x32x8x1_SN_1LDSB1_GRVW8_GSU1_LPB8_LRVW4_MIWT2_2_NEPBS2_NLCA1_PLR5_SS1_SU4_SUS128_SVW2_VW2_WG64_4_1_WGM8
    SolutionIndex: 15
    SolutionNameMin: Cijk_Ailk_Bljk_HHS_BH_MT128x128x32_MI32x32x8x1_SN_1LDSB1_GRVW8_GSU1_LPB8_LRVW4_MIWT2_2_NEPBS2_NLCA1_PLR5_SS1_SU32_SUS128_SVW2_VW2_WG64_4_1_WGM8
    SolutionIndex: 16
    SolutionNameMin: Cijk_Ailk_Bljk_HHS_BH_MT128x16x64_MI16x16x16x1_SN_1LDSB0_GRVW8_GSU1_LPB16_LRVW8_MIWT2_1_NEPBS2_NLCA1_PLR5_SS1_SU0_SUS0_SVW1_VW1_WG64_4_1_WGM1
    SolutionIndex: 17
    SolutionNameMin: Cijk_Ailk_Bljk_HHS_BH_MT128x16x64_MI16x16x16x1_SN_1LDSB0_GRVW8_GSU8_LPB16_LRVW8_MIWT2_1_NEPBS2_NLCA1_PLR5_SS1_SU32_SUS128_SVW2_VW2_WG64_4_1_WGM1
    SolutionIndex: 18
    SolutionNameMin: Cijk_Ailk_Bljk_HHS_BH_MT96x128x64_MI32x32x8x1_SN_1LDSB0_GRVW8_GSU1_LPB8_LRVW8_MIWT3_1_NEPBS2_NLCA3_PLR9_SS1_SU0_SUS0_SVW1_VW1_WG32_8_1_WGM1
    SolutionIndex: 19
    SolutionNameMin: Cijk_Ailk_Bljk_HHS_BH_MT128x16x64_MI16x16x16x1_SN_1LDSB0_GRVW8_GSU7_LPB8_LRVW4_NEPBS2_NLCA1_PLR5_TT2_16_VAW1_WG64_4_1
    SolutionIndex: 20
    SolutionNameMin: Cijk_Ailk_Bljk_HHS_BH_MT128x128x32_MI32x32x8x1_SE_1LDSB0_AF0EM8_EPS0_GRVW8_GSU1_GSUAMB_LBSPP128_LPB8_LRVW8_NLCA1_PGR2_PLR5_SU0_SUS0_SRVW4_TT2_64_TLDS1_VAW2_WSGRA1_WSGRB1_WG64_4_1_WGM1
    SolutionIndex: 21
    SolutionNameMin: Cijk_Ailk_Bljk_HHS_BH_MT128x128x32_MI32x32x8x1_SE_1LDSB0_AF0EM8_EPS0_GRVW8_GSU1_GSUAMB_LBSPP128_LPB8_LRVW8_NLCA1_PGR2_PLR5_SU32_SUS128_SRVW4_TT2_64_TLDS1_VAW2_WSGRA1_WSGRB1_WG64_4_1_WGM2
    SolutionIndex: 22
    SolutionNameMin: Cijk_Ailk_Bljk_HHS_BH_MT64x16x32_MI16x16x16x1_SE_1LDSB0_AF0EM8_EPS0_GRVW4_GSU1_GSUAMB_LBSPP128_LPB16_LRVW8_NLCA1_PGR2_PLR2_SU0_SUS0_SRVW0_TT1_16_TLDS1_VAW2_WSGRA1_WSGRB1_WG64_4_1_WGM1
    SolutionIndex: 23
    SolutionNameMin: Cijk_Ailk_Bljk_HHS_BH_MT64x16x64_MI16x16x16x1_SE_1LDSB0_AF0EM8_EPS0_GRVW2_GSU1_GSUAMB_LBSPP128_LPB16_LRVW8_NLCA1_PGR2_PLR5_SU0_SUS0_SRVW0_TT1_16_TLDS1_VAW2_WSGRA1_WSGRB1_WG64_4_1_WGM1
    SolutionIndex: 24
    SolutionNameMin: Cijk_Ailk_Bljk_HHS_BH_MT128x256x32_MI32x32x8x1_SE_1LDSB1_AF0EM8_EPS0_GRVW8_GSU1_GSUAMB_LBSPP128_LPB8_LRVW8_NLCA1_PGR2_PLR5_SU0_SUS0_SRVW4_TT2_128_TLDS1_VAW2_WSGRA1_WSGRB1_WG64_4_1_WGM15
    SolutionIndex: 25
    SolutionNameMin: Cijk_Ailk_Bljk_HHS_BH_MT32x64x64_MI16x16x16x1_SE_1LDSB0_AF0EM1_EPS0_GRVW8_GSU7_GSUAMB_LBSPP128_LPB16_LRVW8_NLCA1_PGR2_PLR5_SU32_SUS128_SRVW4_TT1_32_TLDS1_VAW1_WSGRA1_WSGRB1_WG32_8_1_WGM15
    SolutionIndex: 26
    SolutionNameMin: Cijk_Ailk_Bljk_HHS_BH_MT16x16x64_MI16x16x16x1_SE_1LDSB0_AF0EM8_EPS0_GRVW4_GSU1_GSUAMB_LBSPP128_LPB16_LRVW8_NLCA1_PGR2_PLR5_SU0_SUS0_SRVW0_TT1_16_TLDS1_VAW2_WSGRA1_WSGRB1_WG16_4_1_WGM1
    SolutionIndex: 27
    SolutionNameMin: Cijk_Ailk_Bljk_HHS_BH_MT128x64x64_MI32x32x8x1_SE_1LDSB0_AF0EM8_EPS1_GRVW8_GSU15_GSUAMB_LBSPP128_LPB8_LRVW8_NLCA1_PGR1_PLR9_SU0_SUS0_SRVW0_TT2_32_TLDS1_VAW1_WSGRA1_WSGRB1_WG64_4_1_WGM1
    SolutionIndex: 28
    SolutionNameMin: Cijk_Ailk_Bljk_HHS_BH_MT128x96x64_MI32x32x8x1_SE_1LDSB0_AF0EM8_EPS0_GRVW8_GSU1_GSUAMB_LBSPP128_LPB8_LRVW8_NLCA1_PGR2_PLR9_SU0_SUS0_SRVW4_TT1_96_TLDS1_VAW2_WSGRA1_WSGRB1_WG128_2_1_WGM15
    SolutionIndex: 29
    SolutionNameMin: Cijk_Ailk_Bljk_HHS_BH_MT64x16x64_MI16x16x16x1_SE_1LDSB0_AF0EM8_EPS0_GRVW8_GSU1_GSUAMB_LBSPP128_LPB16_LRVW8_NLCA1_PGR2_PLR5_SU0_SUS0_SRVW0_TT1_16_TLDS1_VAW2_WSGRA1_WSGRB1_WG64_4_1_WGM1
    SolutionIndex: 30
    SolutionNameMin: Cijk_Ailk_Bljk_HHS_BH_MT64x16x64_MI16x16x16x1_SE_1LDSB0_AF0EM8_EPS0_GRVW2_GSU1_GSUAMB_LBSPP128_LPB16_LRVW8_NLCA1_PGR2_PLR5_SU0_SUS0_SRVW0_TT1_16_TLDS1_VAW2_WSGRA1_WSGRB1_WG64_4_1_WGM2
    SolutionIndex: 31
    SolutionNameMin: Cijk_Ailk_Bljk_HHS_BH_MT64x64x64_MI32x32x8x1_SN_1LDSB0_GRVW8_GSU1_LPB8_LRVW8_MIWT1_1_NEPBS0_NLCA1_PLR9_SS0_SU0_SUS0_SVW4_VW1_WG64_4_1_WGM8
    SolutionIndex: 32
    SolutionNameMin: Cijk_Ailk_Bljk_HHS_BH_MT64x64x32_MI32x32x8x1_SN_1LDSB0_GRVW4_GSU1_LPB8_LRVW8_MIWT1_1_NEPBS2_NLCA1_PLR5_SS0_SU4_SUS256_SVW4_VW1_WG64_4_1_WGM1
    SolutionIndex: 33
    SolutionNameMin: Cijk_Ailk_Bljk_HHS_BH_MT16x64x64_MI16x16x16x1_SN_GRVW8_GSU8_LPB16_LRVW8_MIWT1_1_NEPBS0_PLR5_SS0_SU0_SUS0_SVW4_VW1_WG16_16_1_WGM1
    SolutionIndex: 34
    SolutionNameMin: Cijk_Ailk_Bljk_HHS_BH_MT16x64x64_MI16x16x16x1_SN_GRVW8_GSU7_LPB16_LRVW8_MIWT1_1_NEPBS2_PLR5_SS0_SU4_SUS128_SVW2_VW2_WG16_16_1_WGM8
    SolutionIndex: 35
    SolutionNameMin: Cijk_Ailk_Bljk_HHS_BH_MT32x128x64_MI32x32x8x1_SN_GRVW8_GSU8_LPB8_LRVW4_MIWT1_1_NEPBS2_PLR9_SS0_SU4_SUS128_SVW2_VW2_WG32_8_1_WGM1
    SolutionIndex: 36
    SolutionNameMin: Cijk_Ailk_Bljk_HHS_BH_MT32x128x64_MI32x32x8x1_SN_GRVW8_GSU8_LPB8_LRVW8_MIWT1_1_NEPBS2_PLR9_SS0_SU32_SUS256_SVW4_VW2_WG32_8_1_WGM1
    SolutionIndex: 37
    SolutionNameMin: Cijk_Ailk_Bljk_HHS_BH_MT64x16x64_MI16x16x16x1_SN_GRVW4_GSU8_LPB16_LRVW8_MIWT1_1_NEPBS2_PLR5_SS0_SU0_SUS0_SVW1_VW2_WG64_4_1_WGM2
    SolutionIndex: 38
    SolutionNameMin: Cijk_Ailk_Bljk_HHS_BH_MT64x16x64_MI16x16x16x1_SN_GRVW8_GSU8_LPB16_LRVW8_MIWT1_1_NEPBS2_PLR5_SS0_SU0_SUS0_SVW4_VW2_WG64_4_1_WGM2
    SolutionIndex: 39
    SolutionNameMin: Cijk_Ailk_Bljk_HHS_BH_MT32x32x64_MI16x16x16x1_SN_GRVW8_GSU8_LPB16_LRVW8_MIWT1_1_NEPBS0_PLR5_SS0_SU0_SUS0_SVW2_VW1_WG32_8_1_WGM1
    SolutionIndex: 40
    SolutionNameMin: Cijk_Ailk_Bljk_HHS_BH_MT32x32x64_MI16x16x16x1_SN_GRVW4_GSU7_LPB16_LRVW8_MIWT1_1_NEPBS2_PLR5_SS0_SU32_SUS128_SVW2_VW2_WG32_8_1_WGM2
    SolutionIndex: 41
    SolutionNameMin: Cijk_Ailk_Bljk_HHS_BH_MT16x128x64_MI16x16x16x1_SN_GRVW8_GSU8_LPB16_LRVW8_MIWT1_2_NEPBS2_PLR5_SS0_SU4_SUS128_SVW4_VW1_WG16_16_1_WGM1
    SolutionIndex: 42
    SolutionNameMin: Cijk_Ailk_Bljk_HHS_BH_MT16x128x64_MI16x16x16x1_SN_GRVW8_GSU8_LPB8_LRVW4_MIWT1_2_NEPBS2_PLR5_SS1_SU4_SUS256_SVW1_VW1_WG16_16_1_WGM1
    SolutionIndex: 43
    SolutionNameMin: Cijk_Ailk_Bljk_HHS_BH_MT16x128x64_MI16x16x16x1_SN_GRVW8_GSU8_LPB16_LRVW8_MIWT1_2_NEPBS0_PLR5_SS1_SU4_SUS256_SVW1_VW1_WG16_16_1_WGM8
    SolutionIndex: 44
    SolutionNameMin: Cijk_Ailk_Bljk_HHS_BH_MT16x128x64_MI16x16x16x1_SN_GRVW4_GSU8_LPB4_LRVW4_MIWT1_2_NEPBS0_PLR5_SS0_SU0_SUS0_SVW4_VW1_WG16_16_1_WGM2
    SolutionIndex: 45
    SolutionNameMin: Cijk_Ailk_Bljk_HHS_BH_MT128x32x64_MI32x32x8x1_SN_GRVW8_GSU8_LPB8_LRVW8_MIWT1_1_NEPBS2_PLR9_SS0_SU0_SUS0_SVW4_VW2_WG128_2_1_WGM2
    SolutionIndex: 46
    SolutionNameMin: Cijk_Ailk_Bljk_HHS_BH_MT128x16x64_MI16x16x16x1_SN_GRVW8_GSU8_LPB16_LRVW8_MIWT2_1_NEPBS2_PLR5_SS1_SU0_SUS0_SVW2_VW2_WG64_4_1_WGM8
- - - [1104, 1, 1, 4608, 1104, 1104, 1104, 4608]
    # - [7, 503.342]
    # - [19, 503.342]
    - [45, 417.969]
  - - [1104, 16, 1, 4608, 1104, 1104, 1104, 4608]
    # - [6, 5346.36]
    # - [19, 5346.36]
    - [46, 5279.15]
  - - [1104, 1335, 1, 4608, 1104, 1104, 1104, 4608]
    # - [11, 97522.6]
    - [20, 97522.6]
  - - [1104, 1408, 1, 4608, 1104, 1104, 1104, 4608]
    # - [12, 100122.0]
    - [21, 100122.0]
  - - [4608, 1, 1, 320, 4608, 4608, 4608, 320]
    # - [0, 282.575]
    - [22, 282.575]
    # - [31, 293.831]
  - - [4608, 16, 1, 320, 4608, 4608, 4608, 320]
    # - [4, 4653.9]
    - [23, 4653.9]
    # - [32, 4703.63]
  - - [4608, 1335, 1, 320, 4608, 4608, 4608, 320]
    # - [3, 79631.0]
    - [24, 79631.0]
  - - [4608, 1408, 1, 320, 4608, 4608, 4608, 320]
    # - [15, 88034.7]
    - [24, 88034.7]
  - - [16, 1, 1, 4608, 16, 16, 16, 4608]
    # - [8, 10.1489]
    # - [25, 10.1489]
    # - [33, 12.1536]
    # - [22, 282.575]
    - [40, 11.8846]
  - - [16, 16, 1, 4608, 16, 16, 16, 4608]
    # - [2, 160.36]
    # - [25, 160.36]
    # - [34, 182.0]
    # - [23, 4653.9]
    - [39, 180.63]
  - - [16, 1335, 1, 4608, 16, 16, 16, 4608]
    # - [10, 5020.06]
    # - [26, 5020.06]
    # - [35, 6449.97]
    # - [42, 5592.13]
    - [43, 5452.47]
  - - [16, 1408, 1, 4608, 16, 16, 16, 4608]
    # - [9, 4950.65]
    # - [26, 4950.65]
    # - [36, 6404.07]
    # - [41, 5672.72]
    - [44, 5603.68]
  - - [768, 1, 1, 4608, 768, 768, 768, 4608]
    # - [1, 385.12]
    # - [27, 385.12]
    - [37, 464.993]
  - - [768, 16, 1, 4608, 768, 768, 768, 4608]
    # - [17, 4621.37]
    # - [19, 4621.37]
    - [38, 5441.13]
  - - [768, 1335, 1, 4608, 768, 768, 768, 4608]
    # - [5, 86193.6]
    - [28, 86193.6]
  - - [768, 1408, 1, 4608, 768, 768, 768, 4608]
    # - [18, 97011.9]
    - [28, 97011.9]
  - - [4608, 1, 1, 768, 4608, 4608, 4608, 768]
    # - [0, 441.18]
    - [29, 441.18]
  - - [4608, 16, 1, 768, 4608, 4608, 4608, 768]
    # - [16, 7051.01]
    - [30, 7051.01]
  - - [4608, 1335, 1, 768, 4608, 4608, 4608, 768]
    # - [13, 98060.9]
    - [24, 98060.9]
  - - [4608, 1408, 1, 768, 4608, 4608, 4608, 768]
    # - [14, 105393.0]
    - [24, 105393.0]
- null
- null
- DeviceEfficiency
- null
- Equality
