library/src/amd_detail/rocblaslt/src/Tensile/Logic/asm_full/aldebaran/110CU/Equality/aldebaran_Cijk_Ailk_Bljk_HHS_BH.yaml
- {MinimumRequiredVersion: 4.33.0}
- aldebaran
- gfx90a
- [Device 0050, Device 0051, Device 0052, Device 0054, Device 0062, Device 7400, Device
    SolutionIndex: 0
    SolutionNameMin: Cijk_Ailk_Bljk_HHS_BH_MT64x16x64_MI16x16x16x1_SN_GRVW2_GSU6_MIWT1_1_SU0_SUS0_SRVW0_SVW4_VW2_WG64_4_1_WGM1
    SolutionIndex: 1
    SolutionNameMin: Cijk_Ailk_Bljk_HHS_BH_MT32x16x64_MI16x16x16x1_SN_GRVW8_GSU25_LPB16_LRVW8_MIWT1_1_PLR5_SU0_SUS0_SVW2_VW8_WG32_4_1_WGM8
    SolutionIndex: 2
    SolutionNameMin: Cijk_Ailk_Bljk_HHS_BH_MT16x16x64_MI16x16x16x1_SN_GRVW8_GSU25_LPB16_LRVW8_MIWT1_1_PLR5_SU0_SUS0_SVW4_VW8_WG16_4_1_WGM1
    SolutionIndex: 3
    SolutionNameMin: Cijk_Ailk_Bljk_HHS_BH_MT16x32x64_MI16x16x16x1_SN_GRVW8_LPB8_MIWT1_1_NTB3_NEPBS0_PGR2_PLR5_SPO1
    SolutionIndex: 4
    SolutionNameMin: Cijk_Ailk_Bljk_HHS_BH_MT16x32x64_MI16x16x16x1_SN_GRVW8_LPB8_MIWT1_1_NTB3_NEPBS1_PGR2_PLR5_SPO1
# - - - [1104, 1, 1, 4608]
#     - [30, 905.255]
- - - [1104, 16, 1, 4608]
    - [0, 7016.87]
  # - - [1104, 1335, 1, 4608]
  #   - [1, 110165.0]
  # - - [1104, 1408, 1, 4608]
  #   - [2, 112807.0]
  # - - [4608, 1, 1, 320]
  #   - [3, 526.629]
  # - - [4608, 16, 1, 320]
  #   - [4, 8307.38]
  # - - [4608, 1335, 1, 320]
  #   - [5, 100109.0]
  # - - [4608, 1408, 1, 320]
  #   - [6, 108315.0]
  - - [16, 1, 1, 4608]
    - [1, 15.3855]
  - - [16, 16, 1, 4608]
    - [2, 240.548]
  - - [16, 1335, 1, 4608]
    - [3, 11550.5]
  - - [16, 1408, 1, 4608]
    - [4, 11883.4]
  # - - [768, 1, 1, 4608]
  #   - [31, 758.423]
  # - - [768, 16, 1, 4608]
  #   - [32, 9967.58]
  # - - [768, 1335, 1, 4608]
  #   - [9, 110261.0]
  # - - [768, 1408, 1, 4608]
  #   - [10, 97011.9]
  # - - [4608, 1, 1, 768]
  #   - [3, 739.746]
  # - - [4608, 16, 1, 768]
  #   - [11, 11452.9]
  # - - [4608, 1335, 1, 768]
  #   - [12, 118018.0]
  # - - [4608, 1408, 1, 768]
  #   - [13, 125931.0]
  # - - [320, 8192, 1, 320]
  #   - [14, 72716.5]
  # - - [640, 2048, 1, 640]
  #   - [15, 90161.3]
  # - - [320, 8192, 1, 1280]
  #   - [16, 86784.6]
  # - - [1280, 512, 1, 1280]
  #   - [17, 77328.6]
  # - - [10240, 512, 1, 1280]
  #   - [18, 131298.0]
  # - - [2560, 8192, 1, 320]
  #   - [19, 122856.0]
  # - - [5120, 2048, 1, 640]
  #   - [20, 130990.0]
  # - - [1280, 512, 1, 5120]
  #   - [21, 96509.4]
  # - - [640, 2048, 1, 2560]
  #   - [22, 125691.0]
  # - - [320, 154, 1, 768]
  #   - [23, 8809.83]
  # - - [1280, 154, 1, 768]
  #   - [24, 27734.6]
  # - - [40, 4096, 16, 4096]
  #   - [25, 36289.7]
  # - - [80, 1024, 16, 1024]
  #   - [26, 46837.5]
  # - - [40, 4096, 16, 77]
  #   - [27, 14584.6]
  # - - [80, 1024, 16, 77]
  #   - [28, 16050.5]
  # - - [160, 256, 16, 256]
  #   - [29, 32115.7]
- null
- null
- DeviceEfficiency
- null
- Equality
